<?xml version = "1.0" encoding = "UTF-8"?>
<configuration xmlns:xsi = "http://www.w3.org/2001/XMLSchema-instance" xsi:noNamespaceSchemaLocation = "configuration.xsd">
	<name>database</name>
	<attribute>
		<name>default</name>
		<type>java.lang.String</type>
		<value>NVS</value>
	</attribute>
        <attribute>
		<name>livelink</name>
		<type>java.lang.String</type>
		<value>NVSLivelink</value>
	</attribute>

    <configuration>
		<name>NVS</name>
		<attribute>
			<name>driver</name>
			<type>java.lang.String</type>
            <value>oracle.jdbc.driver.OracleDriver</value>
		</attribute>
		<attribute>
			<name>url</name>
			<type>java.lang.String</type>
			<value>jdbc:oracle:thin:@eeoc95dev:1521:eeocdev</value>
		</attribute>
		<attribute>
			<name>user</name>
			<type>java.lang.String</type>
            <value>cts_o</value>
			<!--<value>eeoccts_o1</value>-->
		</attribute>
		<attribute>
			<name>password</name>
			<type>java.lang.String</type>
			<value>ctsoeeoc</value>
		</attribute>
        <attribute>
			<name>dialect</name>
			<type>java.lang.String</type>
			<value>net.sf.hibernate.dialect.Oracle9Dialect</value>
		</attribute>
        <attribute>
			<name>showSql</name>
			<type>java.lang.String</type>
			<value>true</value>
		</attribute>
	</configuration>
        <configuration>
		<name>NVSLivelink</name>
		<attribute>
			<name>driver</name>
			<type>java.lang.String</type>
            <value>oracle.jdbc.driver.OracleDriver</value>
		</attribute>
		<attribute>
			<name>url</name>
			<type>java.lang.String</type>
			<value>jdbc:oracle:thin:@eeoc95dev:1521:eeocdev</value>
		</attribute>
		<attribute>
			<name>user</name>
			<type>java.lang.String</type>
			<!--<value>eeoclivelink1</value>-->
            <value>livelink</value>
		</attribute>
		<attribute>
			<name>password</name>
			<type>java.lang.String</type>
			<value>CTSLIVELINK</value>
		</attribute>
        <attribute>
			<name>dialect</name>
			<type>java.lang.String</type>
			<value>net.sf.hibernate.dialect.Oracle9Dialect</value>
		</attribute>
        <attribute>
			<name>showSql</name>
			<type>java.lang.String</type>
			<value>true</value>
		</attribute>
	</configuration>
</configuration>