<?xml version="1.0" encoding="UTF-8"?>
<configuration xmlns:xsi="http://www.w3.org/2001/XMLSchema-instance" xsi:noNamespaceSchemaLocation="configuration.xsd">
	<name>Implementation Factory</name>
	<configuration>
		<name>mappings</name>
		<attribute>
			<name>default</name>
			<type>java.lang.String</type>
			<value>remote</value>
		</attribute>
		<attribute>
			<name>client</name>
			<type>java.lang.String</type>
			<value>remote</value>
		</attribute>
		<attribute>
			<name>webapp</name>
			<type>java.lang.String</type>
			<value>remote</value>
		</attribute>
		<attribute>
			<name>ejbclient</name>
			<type>java.lang.String</type>
			<value>local</value>
		</attribute>
		<attribute>
			<name>ejbserver</name>
			<type>java.lang.String</type>
			<value>server</value>
		</attribute>
	</configuration>
	<attribute>
		<name>com.momentumsystems.logon.LogonFilterDecoder</name>
		<type>java.lang.String</type>
		<value>com.momentumsystems.logon.LogonFilterDecoder</value>
	</attribute>
	<attribute>
		<name>com.momentumsystems.util.crypt.Decryptor</name>
		<type>java.lang.String</type>
		<value>com.momentumsystems.util.crypt.ROT13</value>
	</attribute>
	<attribute>
		<name>com.momentumsystems.util.crypt.Encryptor</name>
		<type>java.lang.String</type>
		<value>com.momentumsystems.util.crypt.ROT13</value>
	</attribute>
	<attribute>
		<name>com.momentumsystems.logon.UserInformationFactory</name>
		<type>java.lang.String</type>
		<value>com.momentumsystems.livelink.logon.UserInformationFactory</value>
	</attribute>
	<attribute>
		<name>com.momentumsystems.logon.LogonFilterDecoder</name>
		<type>java.lang.String</type>
		<value>com.momentumsystems.logon.ClearTextDecoder</value>
	</attribute>
	<attribute>
		<name>com.momentumsystems.livelink.SessionTool</name>
		<type>java.lang.String</type>
		<value>com.momentumsystems.livelink.server.SessionTool</value>
	</attribute>
	<attribute>
		<name>com.momentumsystems.livelink.FolderTool</name>
		<type>java.lang.String</type>
		<value>com.momentumsystems.livelink.server.FolderTool</value>
	</attribute>
	<attribute>
		<name>com.momentumsystems.livelink.NodeTool</name>
		<type>java.lang.String</type>
		<value>com.momentumsystems.livelink.server.NodeToolServer</value>
	</attribute>
	<attribute>
		<name>com.momentumsystems.livelink.WorkflowTool</name>
		<type>java.lang.String</type>
		<value>com.momentumsystems.livelink.server.WorkflowTool</value>
	</attribute>
</configuration>
