<?xml version = "1.0" encoding = "UTF-8"?>
<configuration xmlns:xsi = "http://www.w3.org/2001/XMLSchema-instance" xsi:noNamespaceSchemaLocation = "configuration.xsd">
	<name>database</name>
	<attribute>
		<name>default</name>
		<type>java.lang.String</type>
		<value>CTS</value>
	</attribute>
        <attribute>
		<name>livelink</name>
		<type>java.lang.String</type>
		<value>CTSLivelink</value>
	</attribute>

    <configuration>
		<name>CTS</name>
		<attribute>
			<name>driver</name>
			<type>java.lang.String</type>
            <value>oracle.jdbc.driver.OracleDriver</value>
		</attribute>
		<attribute>
			<name>url</name>
			<type>java.lang.String</type>
			<value>jdbc:oracle:thin:@10.0.0.79:1521:orcldev1</value>
		</attribute>
		<attribute>
			<name>user</name>
			<type>java.lang.String</type>
			<value>eeoccts_o1</value>
		</attribute>
		<attribute>
			<name>password</name>
			<type>java.lang.String</type>
			<value>ctsoeeoc</value>
		</attribute>
        <attribute>
			<name>dialect</name>
			<type>java.lang.String</type>
			<value>net.sf.hibernate.dialect.Oracle9Dialect</value>
		</attribute>
        <attribute>
			<name>showSql</name>
			<type>java.lang.String</type>
			<value>true</value>
		</attribute>
	</configuration>
        <configuration>
		<name>CTSLivelink</name>
		<attribute>
			<name>driver</name>
			<type>java.lang.String</type>
            <value>oracle.jdbc.driver.OracleDriver</value>
		</attribute>
		<attribute>
			<name>url</name>
			<type>java.lang.String</type>
			<value>jdbc:oracle:thin:@10.0.0.79:1521:orcldev1</value>
		</attribute>
		<attribute>
			<name>user</name>
			<type>java.lang.String</type>
            <value>eeoclivelink1</value>
		</attribute>
		<attribute>
			<name>password</name>
			<type>java.lang.String</type>
			<value>CTSLIVELINK</value>
		</attribute>
        <attribute>
			<name>dialect</name>
			<type>java.lang.String</type>
			<value>net.sf.hibernate.dialect.Oracle9Dialect</value>
		</attribute>
        <attribute>
			<name>showSql</name>
			<type>java.lang.String</type>
			<value>true</value>
		</attribute>
	</configuration>
</configuration>